project_code,year,title,director,keywords,amount,area,start_date,end_date
D07I1143,2007,Avanzar En Calidad: Desarrollo Y Transferencia De Un Modelo De Gestión De Calidad Para Programas Soc Iales,Teresita Matus Sepúlveda,"Gestión De Calidad, Programas Sociales, Intervención Social",130000.0,Otros,3/5/2009,3/5/2012
D08I1010,2008,Desarrollo Y Evaluacion Experimental De Componentes De Software Interactivos Que Implementan Estrate Gias De Aprendizaje Para Mejorar La Comprension Lectora Y La Produccion Significativa De Textos,Mario Lopez Villarroel,"Mejoramiento De Lectura Y, Componentes De Software I, Programa Virtual De Forma",237600.0,Tic,12/21/2009,12/21/2011
D08I1011,2008,"Optimización Del Cultivo De Semilla De Culengue (Gari Solida), Enfocada Al Cultivo De Engorda.",Elisa Pacheco Sanchez,"Culengue, Cultivo, Semilla",415800.0,Agropecuaria,3/1/2010,3/1/2015
D08I1015,2008,Desarrollo E Implementaciàn De Una Herramienta Computacional Para La Detecciàn De Copias En Document Os Digitales En La Educaciàn: Document Copy Detector (Docode),Juan Velasquez Silva,"Detecciàn De Copias, Web Content Mining, Semantic Web Mining",237600.0,Tic,12/30/2009,12/30/2011
D08I1027,2008,Aumento De La Producción Acuícola: Más Semillas Por Inducción Biotecnológica Del Asentamiento Larval De Moluscos De Interés Comercial,Avelino Muñoz Manterola,"Bioinductor, Compuesto Na, Asentamiento Larval, Complemento Alimenticio",342540.0,Pesca Y Acuicultura,2/1/2010,5/1/2013
D08I1028,2008,Extensión De La Vida Útil De Berries Frescos Mediante El Uso De Envase Eco-Activo,Maria Junqueira C. Goncalves,"Vida Útil De Berries, Envase Activo Antimicrobi, Envases Reciclables-Biode",185476.0,Agropecuaria,3/1/2010,5/31/2013
D08I1031,2008,Droga Botµnica Extraöda Del Alga Nativa Gracilaria Chilensis Para El Tratamiento De /Nresistencia A Insulina Y Diabetes Tipo Ii Y Su Evaluaciàn Como Agente Neuroprotector,Miguel Bronfman A,"Droga Botµnica, Resistencia A La Insulina, Diabetes",219397.0,Pesca Y Acuicultura,1/14/2010,5/30/2013
D08I1039,2008,Biofertilizantes En Base A Rizobacterias /Npara Disminuir El Uso De Nutrientes Fosforados En El Trig O Y Cebada,Luigi Ciampi Panno,"Rizobacterias, Biofertilizantes, Cultivos",283989.0,Agropecuaria,3/1/2010,3/1/2014
D08I1051,2008,Vectores Adenovirales Para La Terapia Génica En El Tratamiento Del Alcoholismo,Juan Asenjo De Leuze,"Alcoholismo, Adenovirus, Terapia Genica",356400.0,Salud,12/29/2009,6/29/2013
D08I1054,2008,"Sistema De Estimación De Eventos Extremos De Lluvia, Para La Prevención Y Mitigación De Los Riesgos De Avenidas Y Caudales Circulantes, En Un Contexto De Variabilidad Y Cambio Climático.",Manuel Pizarro Tapia,"Precipitaciones Extremas, Intensidad De Lluvia, Curvas I - D - F",249060.0,Tic,1/15/2010,1/15/2013
D08I1055,2008,Desarrollo De Productos Biotecnologicos En Base A La Caracterizacion Genomica Y Proteomica De Varian Tes Del Virus Isa Que Sustenten Un Programa De Vigilancia Y Control Sanitario En Chile,Alejandro Yañez Carcamo,"Isav, Genomica Y Proteomica, Biotecnologia",324720.0,Salud,3/1/2010,7/30/2013
D08I1056,2008,"Fortalecimiento Del Sector Energético A Partir De Fuentes Renovables Mediante El Desarrollo De Model Os De Disponibilidad, Gestión Y Transformación De Biomasa Forestal Para Plantas De Cogeneración En E L Sur De Chile",Juan Gómez Fernández,"Energía, Biomasa, Cogeneración",356400.0,Forestal,1/4/2010,1/4/2013
D08I1060,2008,Reconocimiento Inteligente De Patrones Por Video: Aplicaciones En Vigilancia Y Mineria,Claudio Perez Flores,"Reconocimiento De Patrone, Identificación Biométrica, Reconocimiento De Litolog",297548.0,Agropecuaria,3/1/2010,7/1/2013
D08I1067,2008,Biología Y Cultivo Del Alga Roja Comestible Callophyllis Variegata  En El Sur De Chile.,Marcela Avila Lagos,"Callophyllis, Biologia Reproductiva, Cultivo",316800.0,Agropecuaria,1/20/2010,6/20/2013
D08I1074,2008,"Kelluwen : Investigación, Desarrollo Y Validación De Diseños Didácticos Colaborativos Apoyados En Se Rvicios De La Web 2.0. Estrategias Para El Desarrollo De Competencias Socio-Comunicativas En Estudia Ntes De Colegios Vulnerables De La Zona Sur De Chile.",Eliana Scheihing Garcia,"Web 2.0, Entorno Virtual De Aprend, Diseño Didácticos Colabor",231056.0,Tic,1/7/2010,2/7/2013
D08I1075,2008,"Evaluación Del Efecto Producido Por El Reemplazo De La Harina Y Aceite De Pescado Por  Proteínas Y A Ceites  De Origen Vegetal , En  El Aumento De La  Susceptibilidad  A Enfermedades  De Tipo  Parasita Rio , Bacteriano Y  Viral  Del  Salmón Del Atlántico.",Alberto Medina Aguilera,"Salmón Del Atlántico, Sustitución, Harinas  Aceites",326700.0,Pesca Y Acuicultura,3/8/2010,4/30/2014
D08I1076,2008,"Generación De Un Banco De Semen De Caballos Fina Sangre De Tiro Pesado, A Partir Del Diseño De Proto Colos De Criopreservación Para Uso En Inseminación  Artificial (Ia) En El Plan Nacional De Fomento E Quino (Pnfe).",Alfredo Ramirez Reveco,"Criopreservacion De Semen, Hibernacion, Criocapacitacion Espermat",346423.0,Otros,3/1/2010,8/30/2013
D08I1080,2008,Bioprospección De Productos Naturales En Extractos De Polen Apícola Como Aditivos Funcionales Para E L Cluster Agroalimentario Chileno,Gloria Montenegro Rizzardini,"Polen Apícola, Extractos Naturales, Aditivo Funcional",296081.0,Agropecuaria,1/1/2010,1/1/2013
D08I1082,2008,Sistema De Integración Informativa: /Nproductos Derivados,M. Pellegrini Ripamonti,"Periodismo, Regiones , Co, Información, Integración,, Medios, Gestión, Producci",356400.0,Otros,3/1/2010,6/30/2013
D08I1085,2008,Desarrollo De Una Plataforma Tecnológica De Formulación De Vacunas Para La Inmunocastración En Mamíf Eros.,Mario Maino Menendez,"Vacunas, Inmunocastración, Adyuvantes",295380.0,Salud,1/8/2010,1/8/2014
D08I1087,2008,Nuevo Test Diagnostico Molecular Para Identificar Causas De Hipertension Arterial Esencial Con Y Sin Sindrome Metabolico,Carlos Fardella Bello,"Hipertensión Esencial, Cortisol, Sindrome Metabólico",356400.0,Tic,3/1/2010,3/1/2013
D08I1090,2008,Diversificación Acuícola: Innovaciones Tecnológicas Para La Producción De Juveniles De Dorado (Serio La Lalandi) Para La Macro Zona Norte,Antonio Velez Medel,"Acuicultura Macro Zona No, Acondicionamiento Reprodu, Dorado O Palometa (Seriol",396000.0,Pesca Y Acuicultura,3/8/2010,7/7/2013
D08I1096,2008,"Adaptación E Implementación De Método De Producción De Vlps (Virus Like Particles) En Células Y/O La Rvas De Insecto Para El Desarrollo De Vacunas Orales De Bajo Costo, Usando Como Modelo La Generación De Una Vacuna Contra Ipnv",Juan Carcamo Matus,"Ipn, Vacuna Oral, Vlps",346500.0,Salud,3/1/2010,3/31/2013
D08I1097,2008,Evaluación De Recurso Solar En Chile: Apoyo En La Toma De Decisiones Y Formulación De Escenarios Ene Rgéticos,Rodrigo Escobar Moragas,"Energía Solar, Evaluación De Recursos Re, Estimación Satelital",356400.0,Tic,1/4/2010,7/4/2013
D08I1100,2008,Desarrollo De Productos Comerciales A Partir De Paja De Trigo,Alex Berg Gebert,"Paja De Trigo, Deslignificacion, Lignocelulosicos",258425.0,Otros,12/15/2009,2/28/2013
D08I1102,2008,Desarrollo De Metodologías De Verificación Objetiva De La Edad En Carne Tipificada Despostada.,Gerda Tomic Stefanin,"Carne, Edad, Tipificación",297000.0,Otros,3/8/2010,11/30/2012
D08I1104,2008,Una Nueva Estrategia Pesquera-Acuícola Para El Camarón De Río Del Norte (Cryphiops Caementarius): Ba Ses Para La Generación De Un Programa De Manejo Sustentable Del Recurso,Maria Morales Suazo,"Cryphiops Caementarius, Estrategia Pesquero-Acuíc, Siembra De Juveniles",204930.0,Otros,1/8/2010,11/8/2013
D08I1107,2008,Chile Litoral 2025: Modelo De Gestión Territorial Para Asentamientos De Pescadores Artesanales,Francisco Ther Rios,"Desarrollo De La Pesca Ar, Herramientas De Gestión Y, Planificación Sociedades",391050.0,Pesca Y Acuicultura,4/1/2010,4/1/2014
D08I1118,2008,Plataforma Biotecnológica Para La Generación De Tolerancia A Déficit Hídrico En Plantas De Importanc Ia Agrícola,Simon Ruiz Lara,"Tolerancia  A Sequía, Plantas Transgénicas, Maíz",392677.0,Otros,1/15/2010,1/15/2015
D08I1119,2008,Desarrollo De Una Tecnología Base De Cultivo Para La Producción De  Cojinoba Del Norte (Seriolella V Iolacea). 2Da Parte. Producción De Juveniles Y Engorde En Jaulas.,Alfonso Silva Arancibia,"Acuicultura, Cultivo Peces Marinos, Cultivo Cojinoba",337590.0,Agropecuaria,12/15/2009,6/30/2014
D08I1138,2008,Desarrollo De Polímeros Termoestables Reforzados Con Fibras Y Nanopartículas Para Aplicaciones De Al To Desempeño,Paulo Flores Vega,"Carbono, Fibras, Nanotubos",297470.0,Otros,1/6/2010,5/30/2013
D08I1139,2008,Generación De Nuevos Principios Activos Para La Prevención Del Desarrollo De Las Cataratas,Patricio Huenchuñir Gómez,"Cataratas, Desarrollo De Medicamento, Diabetes",356400.0,Otros,12/17/2009,12/17/2012
D08I1141,2008,Desarrollo De Un Prototipo De Producto Dental En Base A Quitosano Y Triclosán Para La Prevención Y T Ratamiento De La Enfermedad Periodontal,Patricio Smith Ferrer,"Triclosan, Enfermedades Periodontale, Quitosano",210873.0,Salud,1/15/2010,5/15/2013
D08I1144,2008,Desarrollo Y Manufactura De Turbinas Eólicas De Alta Eficiencia A Bajas Velocidades De Viento,Renato Hunter Alarcon,"Turbinas Eólicas, Energía, Manufactura",356400.0,Manufactura,3/1/2010,2/27/2014
D08I1147,2008,Investigación Y Generación De Factores De Emisión De Contaminantes Atmosféricos Para Artefactos Resi Denciales Que Combustionan Biomasa De Relevancia Nacional,Luis Diaz Robles,"Contaminacion, Factores De Emision, Biomasa",475200.0,Otros,2/1/2010,12/31/2013
D08I1155,2008,Identificación Semántica Y Composición Automática De Material Didáctico Para Dominios Especializados,Hernan Astudillo Rojas,"Indexación Semántica, Bibliotecas Digitales, Objetos Didácticos Digita",332421.0,Tic,2/1/2010,2/1/2013
D08I1156,2008,Combustible Diesel Y Productos Químicos Finos A Partir Del Tall Oil,Cristina Segura Castillo,"Biocombustible, Tall Oil, Fitoesteroles",265335.0,Energía,12/21/2009,5/21/2013
D08I1160,2008,Cultivo De Camarón De Roca (Rhynchocinetes Typus) En La Región Del Bío-Bío,Marco Retamal Rivas,"Cultivo Acuícola, Camarón De Roca, Rhynchocinetes Typus",115619.0,Agropecuaria,12/1/2009,3/1/2013
D08I1162,2008,Desarrollo De Un Método Inmunológico Mejorado Para El Sexaje De Semen De Ganado Vacuno,Mario Rosemblatt Silber,"Sexaje De Semen Bovino, Separación Inmunomagnétic, Anticuerpos Monoclonales",215471.0,Agropecuaria,3/15/2010,12/31/2013
D08I1163,2008,"Cultivo Y Biotecnología De Ahnfeltia Plicata, Nueva Alternativa En La Producción De Ficocoloides Par A La Región De Magallanes",Andres Mansilla Munoz,"Ahnfeltia Plicata, Biotecnologia, Cultivo",311850.0,Agropecuaria,1/29/2010,1/29/2013
D08I1165,2008,Sistemas Icf:  Una Solución Sismorresistente Y Funcional Para Edificaciones De Baja Y Media Altura,Gilberto Leiva Henriquez,"Edificaciones, Sismorresisitentes, Plataforma Tecnológica",201353.0,Alimentos,12/1/2009,4/1/2012
D08I1179,2008,Desarrollo De Una Prueba Validada Y Normada Para El Diagnostico De La Comprension Lectora En El Sist Ema Escolar Chileno,Bernardo Riffo Ocares,"Comprension De Lectura, Instrumentos De Evaluacio, Capacitacion De Profesore",243595.0,Tic,1/1/2010,11/30/2013
D08I1181,2008,Microbiodiesel,Edelio Taboada Valdés,"Aceite De Microorganismos, Levaduras, Microalgas, Ca, Bioenergía, Tratamiento D",356400.0,Pesca Y Acuicultura,3/1/2010,2/28/2014
D08I1191,2008,Envases Termoplásticos Biodegradables Para La Industria Frutícola Nacional,Alvaro Maldonado Mendoza,"Biodegradable, Impacto Ambiental, Envases",235249.0,Tic,1/4/2010,7/4/2012
D08I1192,2008,Metano Biogénico Como Combustible Vehicular,Rodrigo Borquez Yañez,"Metano Biogénico, Energías Renovables, Gas Natural Vehicular",249983.0,Otros,3/1/2010,5/31/2013
D08I1197,2008,Ciberespacios Para Fortalecer El Aprendizaje De Las Ciencias Básicas En La Enseñanza Media Técnico P Rofesional,Benjamin Suarez Isla,"Evaluación De Aprendizaje, Simuladores (Tics), Ciencias Básicas",342934.0,Tic,1/11/2010,7/31/2013
D08I1199,2008,"Modelo De Gestión Curricular Y Didáctica Asociativo, Orientado Al Fortalecimiento De La Calidad De L A Educación Básica Rural Municipal",Maria Erazo Jimenez,"Gestión Curricular, Asociativismo Municipal, Educación Rural",290304.0,Tic,3/15/2010,3/15/2013
D08I1202,2008,Modelo Silvícola Para La Obtención De Dendroenergía En La Zona Central De Chile Usando Híbridos De A Lamo,Ricardo Baettig Palma,"Dendroenergía, Alamos-Híbridos, Biomasa",282179.0,Otros,2/1/2010,6/1/2014
D08I1204,2008,Estudio Y Diseño De Un Combustor Poroso Para La Poscombustión De Gases Generados En La Combustión Pr Imaria De Leña,Cesar Rosas Zumelzu,"Combustores De Leña, Poscombustion, Medios Porosos Inertes",200883.0,Otros,12/1/2009,12/1/2012
D08I1205,2008,Estrategia Ecosistémica Especializada De Intervención Diferenciada Para Favorecer La Integración Psi Cosocial De Adolescentes Infractores De Ley,Ricardo Perez-Luco Arenas,"Intervención Diferenciada, Integración Psicosocial, Adolescentes Infractores",430688.0,Otros,3/15/2010,4/30/2014
D09I1017,2010,Diseño De Un Modelo Pedagógico De Desarrollo Y Fortalecimiento De Competencias Genéricas Para Mejora R Aprendizajes De Estudiantes De 1Er Ciclo Básico.,Miguel Rivera Diaz,"Competencias Genéricas, M, Autoafirmación, Clima Esc, Factores Asociados Al Apr",173191.0,Educación,1/15/2011,1/15/2014
D09I1018,2010,Investigación Y Desarrollo De Soluciones Para La Gestión De Pavimentos Urbanos En Chile,Carlos Videla Cifuentes,"Pavimentos Urbanos, Gestión De Infraestructur, Derecho Urbano",307351.0,Infraestructura,4/18/2011,4/18/2014
D09I1023,2010,Recursos Pedagógicos Para La Implementación De Los Estándares De Formación Inicial De Profesores De Enseñanza Básica En Matemáticas,Salome Martinez Salazar,"Formación Inicial De Prof, Recursos Pedagógicos, Matemáticas",339111.0,Tic,3/1/2011,3/1/2014
D09I1030,2010,Desarrollo De Herramientas Biotecnológicas En El Formato De Rt-Pcr Tiempo Real Para La Formulación D E Kits Diagnósticos Orientados Al Control De Múltiples Enfermedades De Salmónidos Incluidas En Progr Amas Oficiales,Maria Cabrejos Marin,"Enfermedades Salmónidos, Vigilancia Epidemiológica, Kits Diagnósticos",293377.0,Salud,1/6/2011,1/6/2014
D09I1035,2010,Desarrollo Y Validación De Un Sistema Pericial Basado En Entomofauna Cadavérica Destinado A La Aplic Ación Forense Nacional.,Edoardo Tosti-Croce Astesiano,"Entomología Forense, Colección Entomológica, Capacitación Y Manuales E",190118.0,Otros,3/3/2011,5/5/2014
D09I1036,2010,Sistema Dinámico De Monitoreo De Pastizales En Magallanes.,Sergio Radic Schilling,"Imágenes De Satélite, Pastizales, Ganadería",303643.0,Otros,1/3/2011,1/3/2014
D09I1043,2010,Propuesta Científica De Normativa Para El Desarrollo De Envases Plásticos Inocuos: Una Metodología C Ientífica Tecnológica De Apoyo A Instituciones Públicas Y Privadas Para Fortalecer La Estrategia Nac Ional De Consolidación De La Industria Alimentaria,Maria Galotto Lopez,"Migration, Food Packaging, Food Safety",224222.0,Tic,12/20/2010,3/30/2014
D09I1047,2010,Desarrollar Tecnologías Para La Obtención Y Potencial Uso De Células Troncales Mesenquimáticas Desde Gelatina De Wharton Para El Tratamiento De Lesiones Vasculares Causadas Por Isquemia Crónica De Las Extremidades.,Veronica Palma Alvarado,"Células Troncales Mesenqu, Lesión Vascular Isquémica, Factores Angiogénicos",270034.0,Tic,3/1/2011,10/1/2014
D09I1052,2010,Evaluación Del Recurso Energético Asociado A Corrientes Mareales En El Canal De Chacao Para La Selec Ción E Implementación De Dispositivos De Recuperación De Energía,Rodrigo Cienfuegos Carrasco,"Energias Renovables No Co, Energía Mareomotriz, Modelación Hidrodinámica",388456.0,Tic,3/7/2011,9/7/2014
D09I1057,2010,Desarrollo De Un Biomarcador Eritrocitico De Alta Sensibilidad Para El Diagnóstico De Exposición Pro Longada A Pestidas Órganofosforados,Floria Pancetti Vaccari,"Biomarcador, Organofosforado, Deterioro Cognitivo",305081.0,Tic,3/1/2011,3/1/2014
D09I1058,2010,"Desarrollo De Bases Técnicas Y Normativas Para Prototipos De Vivienda Modular, Con Énfasis En Soluci Ones De Emergencia, Bajo Criterios Técnicos, Geográficos Y Económicos Que Mejoren Su Eficiencia Y Fu Ncionalidad.",Rose Garay Moena,"Viviendas De Emergencia, Sistema De Construcción M, Bases Técnicas Para Const",211224.0,Infraestructura,1/3/2011,6/3/2014
D09I1061,2010,Promoción Del Bienestar Psico-Social En La Escuela. Un Aporte Para La Politica Pública En Educación,Maria Egaña Barahona,"Clima Escolar, Bienestar, Capacitación, Herramienta, Material Educativo",154342.0,Tic,7/1/2011,1/1/2014
D09I1063,2010,Generación De Una Videoteca De Buenas Prácticas Docentes Para La Formación Inicial Y Contínua De Pro Fesores Y Profesoras De Chile,David Preiss Contreras,"Profesores, Formacion Inicial, Perfeccionamiento",298031.0,Agropecuaria,4/1/2011,4/1/2014
D09I1065,2010,Plataforma De Referencia Para El Manejo Genómico Sustentable De Recursos Bentónicos De Interés Comer Cial Y Repoblamiento De Bancos Naturales,Allisson Astuya Villalon,"Repoblamiento, Recursos Bentónicos, Conservación Genómica",294732.0,Otros,3/1/2011,12/1/2013
D09I1067,2010,Biotecnología Aplicada A La Producción De Un Híbrido Entre Abalón Rojo Y Verde (Fase 2): Optimizació N Del Procedimiento De Cruza Para El Desarrollo De Una Variedad De Interés Productivo Y Comercial,Cristian Gallardo Escarate,"Híbridos De Abalón, Selección De Reproductore, Biotecnología",225584.0,Otros,3/1/2011,3/1/2014
D09I1069,2010,Estimación De Demandas Hidricas Mediante Sensores Remotos. Una Herramienta Al Manejo De Agua En La A Gricultura,Eduardo Holzapfel Hoces,"Evapotranspiración, Sensores Remotos, Demandas Hidricas",293413.0,Otros,12/22/2010,6/22/2014
D09I1070,2010,Análisis Y Generación De Base De Datos De Potencial Energético Y Emisiones Contaminantes De Biocombu Stibles De Interés Nacional,Francisco Cereceda Balic,"Biocombustibles Líquidos, Emisiones Contaminantes, Potencial Energético",540314.0,Tic,5/1/2011,5/1/2015
D09I1081,2010,Desarrollo E Introducción Del Sistema De Edificación Pasiva En Chile.,Ricardo Hempel Holzapfel,"Ahorro Energético, Casa P, Mejorar Clima Interior De, Proteger Medio Ambiente,",188333.0,Tic,3/1/2011,3/1/2014
D09I1085,2010,Evaluación Y Desarrollo De Una Orphan Drug  De Origen Botanico Para El Tratamiento De La Esclerosis Múltiple,Juan Hancke Orozco,"Esclerosis Múltiple, Tratamiento, Orphan Drug",237595.0,Otros,12/20/2010,9/30/2014
D09I1094,2010,Redes Inalámbricas De Sensores Con Tecnologías De Múltiples Antenas,Christian Oberli,"Redes Inalámbricas De Sen, Comunicaciones Mimo, Diseño De Circuitos Integ",223498.0,Tic,12/16/2010,5/30/2014
D09I1104,2010,Generacion Y Desarrollo De Nuevos Fármacos Para El Tratamiento De Cánceres Dependientes Del Egfr,Alfonso González De La Rosa,"Cáncer, Receptor Del Factor De Cr, Endocitosis",389248.0,Energía,4/1/2011,4/1/2014
D09I1125,2010,Formulados De Expansinas Para Aumentar El Rendimiento En Trigo,Daniel Calderini Rosso,"Expansinas, Trigo, Rendimiento Y Calidad",353621.0,Otros,4/1/2011,4/1/2016
D09I1136,2010,Programa Chile-Italia De Mejoramiento /NgenTico Del Kiwi Apoyado En La /Nselecciàn Asistida Por Mar Cadores,Rodrigo Infante Espiñeira,"Kiwi, Mejoramiento Genético, Sel Asistida Por Marcador",549385.0,Tic,3/22/2011,3/22/2017
D09I1153,2010,'Desarrollo Biotecnológico Para El Cultivo Sustentable Del Pulpo Patagónico (Enteroctopus Megalocyat Hus),Iker Uriarte Merino,"Paralarvas Y Juveniles, Péptidos Bioactivos, Sistema Inmune",261315.0,Agropecuaria,4/1/2011,4/1/2015
D09I1160,2010,"Producción De Larvas De Anguila Común (Ophichthus Remiger)  A Partir De Un Stock De Reproductores, M Ediante Utilización De Dietas Enriquecidas, Control Microbiológico Y Sistemas De Cultivo En Recircul Ación Para El Acondicionamiento Reproductivo.",Fernando Valenzuela Picon,"Anguila, Acondicionamiento Reprodu, Obtencion De Larvas",302576.0,Agropecuaria,3/1/2011,12/30/2013
D09I1162,2010,Diseño Y Aplicación De Un Sistema De Aseguramiento De Calidad Para Obras De Construcción Habitaciona L En Chile Basado En Criterios Y Estándares De Desempeño (Performance),Leonardo Veas Perez,"Calidad, Prestacional, Vivienda",315650.0,Infraestructura,4/14/2011,5/30/2013
D09I1171,2010,Adapte: Adaptable Domain And Process Technology Engineering,María Bastarrica Piñeyro,"Software Process Improvem, Process Tailoring, Software Process Lines",304540.0,Tic,3/1/2011,3/1/2014
D09I1173,2010,Implementacion De Procesos De Co-Combustion De Carbon Y Biomasa En Chile: Estudio De Factibilidad Te Cnica Y Economica,Ximena Garcia Carmona,"Co Combustión, Carbón/Biomasa, Termogeneración Eléctrica",343836.0,Manufactura,12/20/2010,12/20/2013
D09I1174,2010,Desarrollo De Materiales Para Recapados Asfálticos Utilizados En La Rehabilitación De Pavimentos Det Eriorados,Carlos Wahr Daniel,"Asfalto, Recapados, Pavimentos",320256.0,Tic,1/3/2011,3/31/2014
D09I1185,2010,Observatorios Escalables De La Web En Tiempo Real,Mauricio Marin Chaihuan,"Recuperacion De Informaci, Algoritmos Y Estructuras, Minería De Datos",327289.0,Tic,3/15/2011,3/14/2014
D09I1188,2010,"Declaración Ambiental De Productos Certificada, Iso 14025, Para El Cobre Y Productos De Cobre.",Claudio Zaror Zaror,"Epd, Dap, Declaración Amb, Iso14025, Ecoetiquetado C, Ecoetiquetado Iso Tipo Ii",305454.0,Minería,12/20/2010,4/30/2014
D09I1190,2010,Desarrollo De Un Sistema De Expresión Optimizado Para La Producción De Anticuerpos Terapéuticos,Juan Aguillon Gutierrez,"Biofarmacos, Sistema De Expresión De B, Inmunobiotecnología",638553.0,Salud,12/30/2010,12/30/2015
D09I1195,2010,Materiales Biodegradables En Base A Almidón Para Su Utilización En La Agroindustria Nacional,Alvaro Maldonado Mendoza,"Plasticos, Biodegradable, Almidon",275638.0,Agropecuaria,12/29/2010,4/30/2014
D09I1200,2010,Obtención De Terpenos Con Actividad Antimicótica Desde Trementina Al Sulfato Para El Tratamiento De Candidiasis Oral.,Ninon Rojas Borquez,"Candidiasis, Estomatitis Subpr, Desulfurización",395165.0,Agropecuaria,4/1/2011,4/1/2014
D09I1207,2010,Diseño Y Evaluación De Procesos Para La Extracción Y Purificación De Carotenoides Y Ácidos Grasos W- 3 Y W-6 De Microalgas Usando Dióxido De Carbono Supercrítico,Jose Del Valle Lladser,"Microlagas, Aceite De Pescado, Dioxido De Carbono Superc",389026.0,Pesca Y Acuicultura,3/18/2011,3/18/2014
D09I1222,2010,Optimización De Las Características Saludables De La Dieta De Escolares De Primer Año Básico De La C Omuna De Quillota Con El Objetivo De Disminuir El Riesgo Cardiovascular,Nora Lutz Riquelme,"Riesgo Cardiovascular, Alimentos Saludables, Programas Alimentarios",298299.0,Salud,3/1/2011,3/1/2014
D09I1235,2010,Atomización Ultrasónica Y Sus Aplicaciones Agrícolas E Industriales,Luis Gaete Garreton,"Atomización Ultrasónica, Agroindustria, Ahorro De, Desalinización Agua",358572.0,Agropecuaria,12/20/2010,7/18/2014
D09I1238,2010,Construcción Y Estandarización De Instrumentos De Evaluación Psicométrica Para El Desarrollo De Una Cultura De Evaluación Ética Y Rigurosa.,Ricardo Rosas Diaz,"Evaluación, Psicológica, Instrumentos",204953.0,Tic,5/1/2011,11/1/2012
D09I1240,2010,Desarrollo De Nanotecnologías Como Herramientas De Selección Genética Para La Fabricación De Celulos A Premium.,William Gacitua Escobar,"Nanoindentaciones, Silvicultura Clonal De Pr, Daño Mecánico De Fibras D",440095.0,Forestal,1/4/2011,1/4/2014
D09I1256,2010,"La Dieta Viva Artemia: Un Recurso Local Estratégico Para La Sustentabilidad, Bio-Seguridad Y Costo-E Fectividad Del Programa De Diversificación De La Acuicultura Chilena",Gonzalo Gajardo Galvez,"Artemia, Cepario, Diversificación Acuicola",343257.0,Agropecuaria,1/3/2011,6/30/2014
D09I1262,2010,Innovar En La Tecnología De Proceso Para La Producción De Proteínas Recombinantes Complejas En La Le Che De Mamíferos No Transgénicos. Producción De Eritropoyetina Humana Recombinante Para Su Uso Como Biofármaco,Jorge Toledo Alonso,"Tecnología De Procesos, Biofármacos, Eritropoyetina Humana",418547.0,Manufactura,1/2/2011,1/2/2015
D10I1002,2010,Tecnología Avanzada Para Ciudades Del Futuro,Marcela Munizaga Muñoz,"Transporte Público, Planificación Urbana, Gestión Urbana",319395.0,Otros,12/1/2011,12/1/2014
D10I1006,2010,Desarrollo De Una Herramienta De Control Biológico A Partir De Rizobacterias Nativas De La Zona Cent Ral De Chile,Erwin Aballay Espinoza,"Rizobacterias, Bioantagonistas, Nematodos",115225.0,Salud,12/1/2011,12/1/2014
D10I1007,2010,"Genomica De La Poblacion Chilena: Obtencion De Perfiles Geneticos Necesarios En Investigacion Clinic A, Salud Publica Y Medicina Forense.",Lucia Cifuentes Ovalle,"Perfiles Genéticos, Población Chillena, Medicina Genómica",353214.0,Salud,1/2/2012,1/2/2015
D10I1011,2010,Formación De Competencias Comerciales Y Financieras En Pequeños Empresarios Y Su Evaluación Experime Ntal,Claudio Bravo Ortega,"Competencia, Empresa, Experimento",267109.0,Otros,12/22/2011,12/22/2014
D10I1022,2010,Uso De Ingeniería Metabólica Para El Desarrollo De Plántulas De Manzano Que Poseen  Genes Para La Sí Ntesis De Vitamina A Y Antioxidantes En Los Frutos.,Claudia Stange Klein,"Genes Carotenogénicos, B-Caroteno, Manzana",221482.0,Alimentos,11/8/2011,11/8/2014
D10I1025,2010,Establecimiento De Clases De Infiltración Aceptable De Edificios Para Chile.,Luis Bobadilla Moreno,"Eficiencia Energética, Construcción, Infiltraciones De Aire",320126.0,Tic,12/7/2011,6/7/2014
D10I1027,2010,Desarrollo De Plataforma De Amenaza Sísmica Para El Norte De Chile Y Propuesta De Actualización De N Ormas  De Diseño Sismo-Resistente: Análisis De Los Efectos Del Terremoto Del Maule 2010 Y Caracteriz Ación De Terremotos Tipo En El Segmento Taltal-Arica,Gonzalo Yañez Carrizo,"Sísmico, Amenaza, Normas",346340.0,Otros,5/15/2012,5/15/2015
